0,Bel appartement à vendre à Tanger City Ce,Tanger City Center à Tanger,affaire à saisir pour cet appartement à vendre. prix 1 500 000 dh. 3 pièces 2 salles de bains superficie 75 m². 2 chambres à coucher. nouveau.cet appartement est en vente à tanger city centerEn savoir plus,1500000 DH
1,Appartement de 77m² en vente Hilton Résid,Tanger City Center à Tanger,quoi de plus plaisant qu’un lieu de vie pour une évasion loin du stress ? c’est le cadre que vous offre hilton tanger city .idéalement situé au cœur de tanger dans un emplacement exceptionnel etEn savoir plus,1950000 DH
2,Appartement de 71m² avec 22m² de terrasse,Tanja Balia à Tanger,à quelques minutes de la première tranche qui a eu un grand succès et qui a été entièrement commercialisée cette deuxième tranche n’attend plus que vous !idéalement situé au quartier tanja balia leEn savoir plus,590400 DH
3,Appartement de 97m² en vente Résidence Ri,Agdal à Marrakech,le projet riad garden est situé sur le prestigieux boulevard mohammed vi - quartier de l'agdal et vous offre une vue impressionnante sur les montagnes de l’atlas le complexe couvre plusieurs équipementsEn savoir plus,1564500 DH
4,Appartement de 69m² en vente Résidence Al,Tanja Balia à Tanger,à quelques minutes de la première tranche qui a eu un grand succès et qui a été entièrement commercialisée cette deuxième tranche n’attend plus que vous !idéalement situé au quartier tanja balia leEn savoir plus,496800 DH
5,Appartement de 149m² en vente Résidence Y,De La Plage à Tanger,la résidence yacht plage est la marque signature hautstanding du groupe immobilier ben lemkeddem et fils.d’une signature architecturale d’exception les résidences prestigieuses de yacht plagevousEn savoir plus,Prix à consulter
6,Appartement de 70m² en vente Les jardins,Azzouzia à Marrakech,les jardins d’azzouzia est un projet de logement social situé au quartier el azzouzia une zone structurée avec toutes les facilités locales et socio-économiques primordiales à proximité de nouvelle gareEn savoir plus,250000 DH
7,Bel appartement à vendre à Tanger City Ce,Tanger City Center à Tanger,ne laissez pas passer cet appartement à vendre. prix 1 950 000 dh. 2 pièces 1 salle de bains surface 77 m². 1 chambre à coucher. nouveau.venez découvrir cet appartement à vendre à tanger city centerEn savoir plus,1950000 DH
8,Sublime appartement 2CH à coté de Oliveri,Maârif à Casablanca,laissez-vous tenter par la vie dont vous en avez toujours rêvé et faites le choix d’une résidence d’exception.située en plein centre du maarif platinia 58 offre à ses résidants une autre façon de vivreEn savoir plus,2800000 DH
9,Appartement de 111m² en vente Les Allées,Californie à Casablanca,composée de 4 immeubles en r4 les allées de californie 2 est une résidence fermée et sécurisée située au quartier californie qui vous propose des appartements haut standing de 2 et 3 chambres de superficiesEn savoir plus,1823000 DH
10,Appartement en vente à Abattoirs. Surface,Abattoirs à Agadir,ne laissez pas passer cet appartement à vendre. prix 752 144 dh. 2 chambres 1 salle de bains surface 65 m². 3 pièces lumineuses. nouveau.venez découvrir cet appartement à vendre à abattoirs agadir.,752144 DH
11,Vente d'un bel appartement à Dar Bouazza,Dar Bouazza,faites une belle affaire en achetant cet appartement. prix 530 000 dh. 3 chambres à coucher 1 salle de bains 93 m². cuisine bien équipée.venez découvrir cet appartement à vendre à dar bouazza.,530000 DH
12,Magasin de 141 m² en vente Résidence Les,Maârif à Casablanca,développée par foncia résidences & resorts résidence les érables est conçue comme un grand hôtel avec réception conciergerie de luxe une piscine et une salle de fitness. elle présente un caractèreEn savoir plus,1565000 DH
13,Appartement de 106m² en vente Les Allées,Californie à Casablanca,composée de 4 immeubles en r4 les allées de californie 2 est une résidence fermée et sécurisée située au quartier californie qui vous propose des appartements haut standing de 2 et 3 chambres de superficiesEn savoir plus,1777000 DH
14,Appartement de 86m² en vente Les Jardins,Aïn Sebaâ à Casablanca,les jardins de ain sebaâ 2 vous propose des appartements de standing d’une superficie allant de 71 à 96 m² et ce à un prix 100% déclaré débutant à 924.000 dh !entourée d’espaces verts cette résidenceEn savoir plus,925000 DH
15,Appartement à l'achat à Golf de Bensliman,Golf de Benslimane à Benslimane,shems al madina benslimane présente à tout ceux et celles qui souhaitent finir sonà leur goût des appartements semi-finis à saisir entre 89 et 94 m².plusieurs plans vous sont offerts : 2 chambres à 3En savoir plus,140000 DH
16,Bel appartement à vendre à Hay Hassani. 2,Hay Hassani à Tanger,ne laissez pas passer cet appartement à vendre. 2 chambres 2 salles de bains 70 m². 3 pièces lumineuses. nouveau.venez découvrir cet appartement à vendre à hay hassani. profitezégalement d'un ascenseur.En savoir plus,595000 DH
17,Appartement Haut Standing de 178 m² en ve,Dar Bouazza,la résidence atlantic eden propose 48 appartements de haut standing répartis sur 8 immeubles en r2 érigés en u permettant à ses résidents de profiter d’un climat de quiétude avec une sécurité optimale. deEn savoir plus,2855000 DH
18,Appartement de 124m² en vente place de pa,La Gironde à Casablanca,chraibi immobilier est un projet résidentiel composé de six immeubles situé au cœur de casablanca dans le quartier belevedere-gironde. le projet repose sur un concept fort autour de trois éléments essentielsEn savoir plus,1380000 DH
19,Vend appartement. Superficie 92 m²,Zenata,affaire à saisir pour cet appartement à vendre. prix 980 000 dh. 3 chambres 2 salles de bains 92 m². grande piscine.idéal si vous souhaitez acheter un appartement .,980000 DH
20,Appartement de 84m² JNANE EL ALI,Route de Safi à Marrakech,jnane el ali bénéficie d'une architecture résolument moderne et soignée tout en répondant à une exigence précise : signer un projet d'une grande élégance en alliant avec harmonie matériaux nobles lignesEn savoir plus,798000 DH
21,Appartement de 50 m² en vente Résidence,Bernoussi à Casablanca,ikamati group annonce le lancement de son nouveau projet « jnan sbil »le projet jnan sbil se distingue par son emplacement stratégique entre bernoussi et echo zenata à proximité des axes routiers deEn savoir plus,250000 DH
22,Appartement de 83m² en vente Riad Al Ghiz,Route Casablanca à Marrakech,plus que quelques disponibilités à saisir chez riad al ghizlane !bénéficiant d’un emplacement stratégique dans la ville ocre de marrakech riad al ghizlane est une résidence fermée et sécurisée qui met à votreEn savoir plus,965000 DH
23,Superbe appartement à vendre à Ain Mezoua,Ain Mezouar à Marrakech,2 chambres 60 m²,520000 DH
24,Luxueux Duplex en dernier étage avec vue,Maârif à Casablanca,3 chambres 189 m²,4800000 DH
25,Appartement de luxe en vente neuf,Souissi à Rabat,2 chambres 125 m²,3700000 DH
26,Appartement à l'achat à Riad Oulad Mtaa,Riad Oulad Mtaa à Temara,2 chambres 145 m²,2800000 DH
27,Penthouse OS en vente neuf,Souissi à Rabat,4 chambres 289 m²,8993890 DH
28,Bel appartement à vendre à Béni Mellal. S, à Béni Mellal,3 chambres 142 m²,570000 DH
29,Appartement de 153m² au lotissement Nour, à Béni Mellal,3 chambres 153 m²,590000 DH
30,Appartement neuf en vente à Riyad. 3 bell,Riyad à Rabat,3 chambres 210 m²,4800000 DH
31,Appartement neuf à vendre à Ain Atig, à Ain Attig,2 chambres 76 m²,610000 DH
32,Appartement dans résidence charmante sécu,Ennakhil (Palmeraie) à Marrakech,3 chambres 225 m²,2200000 DH
33,Appartement de 154m² en vente Eden Islan,Plage Oued Cherrat à Bouznika,découvrez « eden island » une réalisation unique située sur l’une des plus belles plages du maroc.devenez propriétaire d’un bel appartement neuf et moderne dans un espace de vie verdoyant bordé par lesEn savoir plus,3541000 DH
34,Appartement de 105m² en vente AS Living,Aïn Sebaâ à Casablanca,le projet résidentiel « as living » est le nouveau symbole de modernité au quartier ain sebaâ.le projet propose des appartements et studios de standing allant de 49 à 108 m² à partir 581.000 dh.· 1 à 3En savoir plus,1108000 DH
35,Appartement de 116m² en vente UTOPIA,Californie à Casablanca,utopia le 1er complexe résidentiel du quartier californie !imaginez-vous vivre dans un cadre idyllique où une multitude d’espaces de détente et de loisirs au sein même de la résidence : piscine espacesEn savoir plus,1797000 DH
36,Appartement de 57m² en vente AL ARSAT ES,Oulfa à Casablanca,projet al arsat essalamal arsat essalam est un projet résidentiel idéalement situé à l’entrée du pôle urbanisé de errahma à proximité immédiate de la nouvelle rocade urbaine.le projet vous offre toutesEn savoir plus,250000 DH
37,P. V00171 Appartements Neufs à Cabo Negro,Cabo Negro,des appartements neufs de moyen haut standing à vendre à cabo negro.le projet est en cours de construction.ils se situent dans un grand complexe touristique sécurisé 24h/24h avec 3 grandes piscines desEn savoir plus,870000 DH
38,Appartement de 72m² en vente Résidence Ai,Mhamid à Marrakech,le projet aïn raha se situe au quartier m'hamid sud sur avenue guemassa à 5 minutes de l’avenue mohammed vi ; il se distingue par son emplacement stratégique à proximité des transports équipements etEn savoir plus,250000 DH
39,Appartement de 71m² en vente Résidence Al,Tanja Balia à Tanger,à quelques minutes de la première tranche qui a eu un grand succès et qui a été entièrement commercialisée cette deuxième tranche n’attend plus que vous !idéalement situé au quartier tanja balia leEn savoir plus,511200 DH
40,Appartement de 118m² en vente Résidence,Moujahidine à Tanger,.la résidence rumaisa est le nouveau projet signé qunci immobilier un projet résidentiel standing premium. depuis leur nouveau lieu de vie les résidents rejoignent le centre commercial soco alto enEn savoir plus,Prix à consulter
41,Appartement 101m² en vente Eden Island B,Plage Oued Cherrat à Bouznika,découvrez « eden island » une réalisation unique située sur l’une des plus belles plages du maroc.devenez propriétaire d’un bel appartement neuf et moderne dans un espace de vie verdoyant bordé par lesEn savoir plus,2350000 DH
42,Superbe appartement à vendre à VICTOR HUG,Camp Al Ghoul à Marrakech,la résidence auguste renoir située en plein cœur du centre-ville de marrakech dans le quartier mythique de victor hugo la résidence auguste renoir offre une architecture contemporaine et raffinée afin deEn savoir plus,2030000 DH
43,Appartement de 66m² en vente Résidence Ai,Mhamid à Marrakech,le projet aïn raha se situe au quartier m'hamid sud sur avenue guemassa à 5 minutes de l’avenue mohammed vi ; il se distingue par son emplacement stratégique à proximité des transports équipements et lieux deEn savoir plus,250000 DH
44,Bel appartement à vendre à Malabata. Surf,Malabata à Tanger,se réveiller au quotidien sur une mer au bleu naturel dans l’un des quartiers les plus luxueux de la ville de tanger c’est désormais possible avec les belles résidences !situé au cœur du quartier de malabataEn savoir plus,Prix à consulter
45,Vend appartement à Aïn Sebaâ. 3 chambres,Aïn Sebaâ à Casablanca,achetez votre appartement. prix 1 042 000 dh. 4 pièces 2 salles de bains superficie 92 m². 3 chambres. 2ème étage. nouveau.idéal si vous souhaitez acheter un appartement à aïn sebaâ casablanca.,1042000 DH
46,Appartement de 97m² en vente Résidence Ri,Agdal à Marrakech,le projet riad garden est situé sur le prestigieux boulevard mohammed vi - quartier de l'agdal et vous offre une vue impressionnante sur les montagnes de l’atlas le complexe couvre plusieurs équipements deEn savoir plus,1564500 DH
47,Appartement de 94m² en vente Résidence Al,Tanja Balia à Tanger,à quelques minutes de la première tranche qui a eu un grand succès et qui a été entièrement commercialisée cette deuxième tranche n’attend plus que vous !idéalement situé au quartier tanja balia le projetEn savoir plus,708000 DH
48,Top appartement 99m² à El Mansouria bien,El Mansouria,le maitre du foncier vous propose une très belle opportunité un appartement de 99m dont 26m de terrasse contient trois façades bien ensoleillé situé au milieu de marbella beach au deuxième étage prêt de laEn savoir plus,870000 DH
49,Studio de 62m² 57m² de terrasse bien enso,Aïn Sebaâ à Casablanca,on vous propose un très beau studio de 62m habitable 57m de terrasse dont une partie qui pourra devenir une chambre; situé au troisième étage très bien ensoleillé orienté plein sud. il comprend une grandeEn savoir plus,880000 DH
50,Appartement de 60m² en vente Projet Kenz,Sidi Abdelkarim à Settat,kenzi settat est un projet social de yasmine immobilier situé dans le quartier tawfik offrant 550 appartements entre 50m² et 67m² aménagé dans un parc de 7800m² de verdure à partir de 190 000 dhs.le projetEn savoir plus,250000 DH
51,Duplex de 80m² en vente Résidence Sania,Sania à Tanger,résidence sania : le luxe entre vos mains aux meilleurs prix ! nouveau projet haut standing signature du groupe real estate tanger la résidence sania offre à ses habitants un cadre de vie calme sécurisé etEn savoir plus,Prix à consulter
52,Vend appartement à Boukhalef. 2 belles ch,Boukhalef à Tanger,vous êtes à la recherche d'un appartement de qualité dans un emplacement stratégique de la ville de tanger ? vous êtes à la bonne place .idéalement situé sur la route de rabat à l'embouchure des deux entréesEn savoir plus,250000 DH
53,Appartement de 99m² avec 13m² de terrasse,Bourgogne Ouest à Casablanca,votre nid familial en plein centre de casablanca est là: la résidence haut standing famille d’amour a pour objectif d’offrir le confort et la proximité idéaux qui accompagneront votre vie de famille active auEn savoir plus,1806750 DH
54,Vente d'un bel appartement à Dar Bouazza,Dar Bouazza,faites une belle affaire en achetant cet appartement. 2 chambres 1 salle de bains 82 m².cet appartement est proposé à la vente à dar bouazza. cuisine entièrement équipée.,Prix à consulter
55,Apartement de 62m² en vente Résidence El,Bernoussi à Casablanca,avec plus de 35 ans d’expérience le groupe ikamati réputé pour la qualité de ses matériaux de construction vous présente votre chez-soi clé en main à la résidence el yassamine. la résidence de standing quiEn savoir plus,590000 DH
56,Appartement 97m deux facades,Hay Nahda à Rabat,3 chambres 97 m²,650000 DH
57,Appartement au milieu de centre ville,Mers Sultan à Casablanca,2 chambres 124 m²,120000 DH
58,Appart à vendre 90 m2 à Temara centre,Centre Ville à Temara,2 chambres 90 m²,765000 DH
59,Un apparteement en bon état à vendre,Ain Diab à Casablanca,2 chambres 94 m²,2000000 DH
60,Appartement de luxe au dessus du café HAR,Hamria à Meknes,3 chambres 167 m²,1580000 DH
61,Appartement de 66 m² en vente rés. Jet S,Sidi Maarouf à Casablanca,2 chambres 66 m²,605000 DH
62,Joli appartement à vendre plein centre vi,Centre Ville à Casablanca,3 chambres 116 m²,1750000 DH
63,Joli appartement,Roches Noires à Casablanca,3 chambres 131 m²,880000 DH
64,Appartement rénové en rez de chaussée de,Riad Al Atlas à Marrakech,2 chambres 136 m²,2500000 DH
65,À vendre Bel appartement Résidence SEMIRA,Sidi Hajji à Salé,2 chambres 84 m²,720000 DH
66,Vente d'un bel appartement à Moujahidine,Moujahidine à Tanger,faites une belle affaire en achetant cet appartement. 3 chambres à coucher 2 salles de bains 87 m².idéal si vous souhaitez acheter un appartement à moujahidine. résidence équipée d'un ascenseur. vousEn savoir plus,Prix à consulter
67,Appartement à vendre à Ain Diab Extension,Ain Diab Extension à Casablanca,le boulevard de biarritz devient la nouvelle adresse luxe à anfa !situé à 2 minutes du morocco mall biarritz anfa océan est le nouveau projet immobilier haut standing signé anwar luxury.fidèle à sesEn savoir plus,1804000 DH
68,Appartement de 78m² en vente Résidence Di,Maârif Extension à Casablanca,idéal pour les investisseurs ou les jeunes actifs à la recherche d’une acquisition la résidence diazest un projet qui concilie entre centre-ville et calme inouï.avant-gardisme et confort En savoir plus,1544000 DH
69,Studio de 67m² et 6m² de terrasse LIV'IN,Maârif Extension à Casablanca,idéal pour les jeunes actifs et pour les familles à la recherche d’une acquisition alliantcalme et sécurité la résidence liv’in garden est plus qu’un simple projet résidentielc’est la parfaite harmonieEn savoir plus,1330000 DH
70,Appartement de 101m² en vente Eden Islan,Plage Oued Cherrat à Bouznika,découvrez « eden island » une réalisation unique située sur l’une des plus belles plages du maroc.devenez propriétaire d’un bel appartement neuf et moderne dans un espace de vie verdoyant bordé par lesEn savoir plus,2250000 DH
71,Appartement de 83m² en vente Les Jardins,Mesnana à Tanger,le projet s’étend sur 18 hectares à 5 minutes du centre commercial socco alto à proximité du golf royal les jardins de mesnana golf est un projet moyen standing qui assure à ses résidents un meilleurEn savoir plus,784000 DH
72,Bel appartement à vendre. 3 chambres,Zenata,agréable duplex à vendre. prix 1 350 000 dh. 4 pièces 2 salles de bains privatives 111 m². 3 chambres. nouveau. piscine.venez découvrir cet appartement à vendre .,1350000 DH
73,Appartement de 54m² en vente Résidence Ai,Mhamid à Marrakech,le projet aïn raha se situe au quartier m'hamid sud sur avenue guemassa à 5 minutes de l’avenue mohammed vi ; il se distingue par son emplacement stratégique à proximité des transports équipements etEn savoir plus,250000 DH
74,Rez de jardin à vendre à Prestigia Bousko,Bouskoura,magnifique rez de jardin traversantà vendre à prestigia bien agencé orienté plein sud lumineux spacieux composant d'un grand salon avec des baies vitrées ouvert sur jardin et terrasse coin salle à mangerEn savoir plus,3600000 DH
75,Superbe appartement à vendre à Tanger Cit,Tanger City Center à Tanger,agréable appartement à vendre. prix 1 950 000 dh. 2 pièces 1 salle de bains surface 77 m². 1 chambre à coucher. nouveau.cet appartement est en vente à tanger city center tanger.proche de toutesEn savoir plus,1950000 DH
76,Superbe appartement à vendre à Boukhalef,Boukhalef à Tanger,vous êtes à la recherche d'un appartement de qualité dans un emplacement stratégique de la ville de tanger ? vous êtes à la bonne place .idéalement situé sur la route de rabat à l'embouchure des deux entréesEn savoir plus,250000 DH
77,Vente d'un bel appartement à Abattoirs. S,Abattoirs à Agadir,achetez votre appartement. prix 680 000 dh. 2 pièces 1 salle de bains 58 m². 2 chambres. nouveau.venez découvrir cet appartement à vendre à abattoirs agadir.,680000 DH
78,Appartement F4 de 132m² en vente Harhour,Harhoura,harhoura hills est un projet balnéaire avec deux façades offrant une magnifique vue sur mer. il vous propose des appartements haut standing de 64 m² à 147 m² à plusieurs configurations.situé au niveau de laEn savoir plus,Prix à consulter
79,Appartement de 117m² 18m² de terrasse en,Sania à Tanger,une architecture avant-gardiste où les planchers du bâtiment se décalent pour créer une illusion optique telle est l’illustration de la résidence horizon hill qui attire le regarde de tous les passants. cetEn savoir plus,2646000 DH
80,Superbe appartement à vendre à Tanger Cit,Tanger City Center à Tanger,opportunité unique pour cet appartement à vendre. prix 1 500 000 dh. 2 chambres 2 salles de bains 75 m². 3 pièces lumineuses. nouveau.venez découvrir cet appartement à vendre à tanger city centerEn savoir plus,1500000 DH
81,Appartement à vendre à Castilla. 3 chambr,Castilla à Tanger,présentant une architecture moderne et épurée la résidence paradis est située dans le centre-ville de tanger. la résidence paradis vous propose des appartements haut standing de 2 à 4 chambressalon à partirEn savoir plus,Prix à consulter
82,Appartement de 93m² dont 7m² de terrasse,Ain Diab Extension à Casablanca,idéalement situé aux portes de ain diab à seulement deux kilomètres du morocco mall anfa heaven a été conçu pour offrir un cadre de vie paisible et doux qui rompt avec le tumulte de la capitale économique.En savoir plus,2140000 DH
83,Bel appartement à vendre à Golf de Bensli,Golf de Benslimane à Benslimane,shems al madina benslimane présente à tout ceux et celles qui souhaitent finir sonà leur goût des appartements semi-finis à saisir entre 89 et 94 m².plusieurs plans vous sont offerts : 2 chambres à 3En savoir plus,230000 DH
84,Bel appartement à vendre à Tanger City Ce,Tanger City Center à Tanger,achetez votre appartement. prix 1 950 000 dh. 2 pièces 1 salle de bains surface 77 m². 1 chambre à coucher. nouveau.venez découvrir cet appartement à vendre à tanger city center tanger.à proximité:En savoir plus,1950000 DH
85,Studio de 80m² et 28m² de terrasse LIV'I,Maârif Extension à Casablanca,idéal pour les jeunes actifs et pour les familles à la recherche d’une acquisition alliantcalme et sécurité la résidence liv’in garden est plus qu’un simple projet résidentielc’est la parfaite harmonieEn savoir plus,1770000 DH
86,Appartement de 57m² en vente Projet Diya,Boukhalef à Tanger,vous êtes à la recherche d’un appartement de qualité dans un emplacement stratégique de la ville de tanger ? vous êtes à la bonne place !idéalement situé sur la route de rabat à l’embouchure des deux entréesEn savoir plus,250000 DH
87,Vente d'un bel appartement à Agdal. 2 cha,Agdal à Marrakech,agréable appartement à vendre. prix 1 680 000 dh. 2 chambres 1 salle de bains superficie 97 m². 3 pièces. nouveau. piscine.cet appartement est proposé à la vente à agdal marrakech.,1680000 DH
88,Appartement Haut Standing à Guéliz,Guéliz à Marrakech,bel appartement f2 composés d'une chambre un salon et une terrasse au cœur de gueliz sur l'avenu hassan ii au sein du projet caprice. d'ôté d'une finition luxueuse carrelage de haute qualité  cuisineEn savoir plus,445500 DH
89,Bel appartement à vendre à Dar Bouazza, à Dar Bouazza,2 chambres 86 m²,950000 DH
90,Appartement a vendre à Bouskoura golf res, à Bouskoura,2 chambres 125 m²,2290000 DH
91,Vend appartement à Hay Toummert. 2 grande,Hay Toummert à Bouznika,3 chambres 63 m²,470000 DH
92,Appartement 3 chambres,Route de Meknes à Fès,3 chambres 98 m²,550000 DH
93,Appartement Racine entièrement refait à n,Racine à Casablanca,3 chambres 183 m²,3400000 DH
94,Appartement haut standing,Ferme Bretonne (Hay Arraha) à Casablanca,3 chambres 114 m²,2240000 DH
95,Un Trésor Caché Devant Rond Point Venezia,Ain Diab Extension à Casablanca,3 chambres 148 m²,2450000 DH
96,Appartement haut standing,Ferme Bretonne (Hay Arraha) à Casablanca,2 chambres 86 m²,1548000 DH
97,Appartement haut standing,Ferme Bretonne (Hay Arraha) à Casablanca,4 chambres 119 m²,2340000 DH
98,Appartement à l'achat à Errahma. Surface, à Errahma,2 chambres 52 m²,380000 DH
99,Appartement F2 de 59m² en vente Résidence,Oasis à Casablanca,sur la route d’el jadida un emplacement stratégique à casablanca s’est installée la résidence les palmiers. une résidence qui fait de votre confort au quotidien son leitmotiv. une résidence qui vousEn savoir plus,1239000 DH
100,Appartement de 158m² 14m² de terrasse en,Sania à Tanger,une architecture avant-gardiste où les planchers du bâtiment se décalent pour créer une illusion optique telle est l’illustration de la résidence horizon hill qui attire le regarde de tous les passants.En savoir plus,2970000 DH
101,Appartement de 56m² en vente AL ARSAT ES,Oulfa à Casablanca,ne laissez pas passer cet appartement à vendre. prix 250 000 dh. 2 chambres 1 salle de bains surface 56 m². 3 pièces. moins d'un an. grande terrasse.idéal si vous souhaitez acheter un appartement àEn savoir plus,250000 DH
102,Superbe appartement à vendre à Oasis. 2 b,Oasis à Casablanca,affaire à saisir pour cet appartement à vendre. prix 1 900 000 dh. 3 pièces 2 salles de bains 98 m². 2 chambres. nouveau. résidence sécurisée et antenne parabolique. le bien dispose également d'un beauEn savoir plus,1900000 DH
103,Appartement au RDC de 70m² en vente Résid,Maârif Extension à Casablanca,idéal pour les investisseurs ou les jeunes actifs à la recherche d’une acquisition la résidence diazest un projet qui concilie entre centre-ville et calme inouï.avant-gardisme et confort En savoir plus,1339000 DH
104,Appartement de 94m² en vente Residence d,Dar Bouazza,vivre dans un cadre apaisant à quelques minutes de casablanca fait partie de vos projets de vie ? un cadre qui vous permettra de vous sentir en vacances toute l’année ? véritable havre de paix laEn savoir plus,Prix à consulter
105,Appartement à vendre à Hay Hassani. Surfa,Hay Hassani à Tanger,affaire à saisir pour cet appartement à vendre. 2 pièces 1 salle de bains surface 50 m². 1 chambre. nouveau.idéal si vous souhaitez acheter un appartement à hay hassani.dispose également d'unEn savoir plus,425000 DH
106,Vend appartement à Aïn Sebaâ. 3 chambres,Aïn Sebaâ à Casablanca,découvrez cet appartement à vendre. prix 1 042 000 dh. 4 pièces 2 salles de bains surface 92 m². 3 chambres à coucher. nouveau. sécurité assurée.idéal si vous souhaitez acheter un appartement à aïnEn savoir plus,1042000 DH
