107,Appartement de 113m² en vente à bourgogn,Bourgogne Ouest à Casablanca,votre nid familial en plein centre de casablanca est là: la résidence haut standing famille d’amour a pour objectif d’offrir le confort et la proximité idéaux qui accompagneront votre vie de famille active auEn savoir plus,1806750 DH
108,Appartement Haut Standing de 245 m² en ve,Dar Bouazza,la résidence atlantic eden propose 48 appartements de haut standing répartis sur 8 immeubles en r2 érigés en u permettant à ses résidents de profiter d’un climat de quiétude avec une sécurité optimale. deEn savoir plus,3380000 DH
109,Appartement de 82m² en vente Residence d,Dar Bouazza,vivre dans un cadre apaisant à quelques minutes de casablanca fait partie de vos projets de vie ? un cadre qui vous permettra de vous sentir en vacances toute l’année ? véritable havre de paix la résidenceEn savoir plus,530000 DH
110,Appartement de 76m² en vente Résidence Al,Ghazoua à Essaouira,entre maisons individuelles et villas dans le quartier résidentiel d’al ghazoua prisé par les souiris pour la vie de famille la résidence al yassamine se dessine sobrement dans un style architecturalEn savoir plus,466000 DH
111,Appartement de 57m² en vente Résidence Ai,Mhamid à Marrakech,le projet aïn raha se situe au quartier m'hamid sud sur avenue guemassa à 5 minutes de l’avenue mohammed vi ; il se distingue par son emplacement stratégique à proximité des transports équipements et lieux deEn savoir plus,250000 DH
112,Appartement de 140m² en vente Résidence R,Agdal à Marrakech,le projet riad garden est situé sur le prestigieux boulevard mohammed vi - quartier de l'agdal et vous offre une vue impressionnante sur les montagnes de l’atlas le complexe couvre plusieurs équipements deEn savoir plus,2278500 DH
113,Appartement F4 de 112m² en vente Harhour,Harhoura,harhoura hills est un projet balnéaire avec deux façades offrant une magnifique vue sur mer. il vous propose des appartements haut standing de 64 m² à 147 m² à plusieurs configurations.situé au niveau de laEn savoir plus,Prix à consulter
114,Appartement F4 de 115m² en vente Harhour,Harhoura,harhoura hills est un projet balnéaire avec deux façades offrant une magnifique vue sur mer. il vous propose des appartements haut standing de 64 m² à 147 m² à plusieurs configurations.situé au niveau de laEn savoir plus,Prix à consulter
115,Appartement de 72m² en vente Les Jardins,Mesnana à Tanger,le projet s’étend sur 18 hectares à 5 minutes du centre commercial socco alto à proximité du golf royal les jardins de mesnana golf est un projet moyen standing qui assure à ses résidents un meilleur cadre deEn savoir plus,718200 DH
116,Studio de 47m² en vente LIV'IN Garden,Maârif Extension à Casablanca,idéal pour les jeunes actifs et pour les familles à la recherche d’une acquisition alliantcalme et sécurité la résidence liv’in garden est plus qu’un simple projet résidentielc’est la parfaite harmonieEn savoir plus,985000 DH
117,Vend appartement à Guéliz. 1 chambre,Guéliz à Marrakech,faites une belle affaire en achetant cet appartement. prix 445 500 dh. 1 salle de bains surface de 45 m². 1 pièces. 1 chambre à coucher. nouveau. nous mettons à votre disposition un service de conciergerieEn savoir plus,445500 DH
118,Appartement a vendre,Mghogha à Tanger,appartement a vendre a tangre 74 m2 trois chambre a coucher 3 eme etage a mghroura securiser ,390000 DH
119,Appartement a vendre a fes,Quartier Oued Fes à Fès,appartement a vendre 110 m2 3 chambre a coucher salon 2 wc 2 façade bien ensoleille a wed fes proximite hotel ibis et marjan ,520000 DH
120,Bel appartement à vendre à Abattoirs. 2 b,Abattoirs à Agadir,agréable appartement à vendre. prix 688 905 dh. 2 pièces 1 salle de bains 65 m². 2 chambres. nouveau.venez découvrir cet appartement à vendre à abattoirs agadir.,688905 DH
121,Appartement Haut Standing de 206 m² en ve,Dar Bouazza,la résidence atlantic eden propose 48 appartements de haut standing répartis sur 8 immeubles en r2 érigés en u permettant à ses résidents de profiter d’un climat de quiétude avec une sécurité optimale. deEn savoir plus,3240000 DH
122,Apprtement à vendre شقة للبيع مارتيل, à Martil,2 chambres 50 m²,400000 DH
123,Bel appartement ensoleillé calme bien a, à Tamesna,2 chambres 71 m²,715000 DH
124,Appartement Haut Standing Racine No Age,Racine à Casablanca,3 chambres 196 m²,2950000 DH
125,Superbe appartement à vendre à Guéliz. 2,Guéliz à Marrakech,3 chambres 134 m²,220000 EUR
126,Appartement 3 chambres a vendre Marrakech,Daoudiat à Marrakech,3 chambres 132 m²,1350000 DH
127,Appartements neufs à vendre bonne finitio,Sidi Maarouf à Casablanca,2 chambres 58 m²,580000 DH
128,Appartement à vendre centre ville Très bo,Lusitania à Casablanca,1 chambre 122 m²,1350000 DH
129,Appartement de style ancien,Port Tanger ville à Tanger,3 chambres 144 m²,1650000 DH
130,Appartement en vente à Quartier du Parc,Quartier du Parc à Mohammedia,2 chambres 65 m²,1030000 DH
131,Joli appartement à lmhamid de 103 M2,Mhamid à Marrakech,3 chambres 103 m²,680000 DH
